{
  "$schema": "http://json-schema.org/draft-07/schema#",
  "$id": "https://cyberforge.dev/schemas/residual-risk.schema.json",
  "title": "Residual-risk statement (DORA Art. 5(2) / ISO 27001:2022 Clause 6.1.2)",
  "description": "Schema for residual-risk.json, emitted by scripts/validators/risk_acceptance.py (task T-121). It is the machine-readable substrate of the Part D.4 residual-risk statement: an aggregation of the OPEN (Active) accepted ICT risks parsed from docs/compliance/exception-register.md (Part J.2 risk-acceptance / exceptions log), tied to the board-approved risk tolerance. DORA Art. 5(2) requires the management body to determine the appropriate ICT risk tolerance level; ISO 27001:2022 Clause 6.1.2 requires board-approved risk-acceptance criteria with a named risk owner per accepted risk. The validator carries the T-33 envelope so the compliance gate (T-30) and matrix consume it uniformly. HONESTY: signed_by_accountable_officer is always false here — the officer's signature is a human act applied at seal time (sign-and-attest), never asserted by the validator.",
  "type": "object",
  "required": ["status", "tier", "measured", "residual_risk"],
  "additionalProperties": true,
  "properties": {
    "status": {
      "type": "string",
      "enum": ["PASS", "FAIL", "INDETERMINATE"],
      "description": "T-33 envelope status. PASS only when every Active acceptance is bounded (named approver + named owner + justification + future expiry <=12mo). FAIL on any unbounded/invalid acceptance (spec §8 anti-pattern #5). INDETERMINATE when the register is missing/unparseable."
    },
    "tier": {
      "type": "string",
      "enum": ["BLOCKING", "EVIDENCE-ONLY"],
      "description": "Always BLOCKING — an unbounded risk acceptance is a documented rejection trigger."
    },
    "measured": {
      "description": "T-33 measured value: open_count and violation count, or null when INDETERMINATE.",
      "oneOf": [
        { "type": "null" },
        {
          "type": "object",
          "required": ["open_count", "violations"],
          "additionalProperties": true,
          "properties": {
            "open_count": { "type": "integer", "minimum": 0 },
            "violations": { "type": "integer", "minimum": 0 }
          }
        }
      ]
    },
    "threshold": { "type": ["string", "null"] },
    "detail": { "type": "string" },
    "tool_version": { "type": ["string", "null"] },
    "validator": { "type": "string" },
    "checked_at": { "type": "string", "format": "date-time" },
    "register": {
      "type": "string",
      "description": "Path to the source exception register parsed."
    },
    "errors": {
      "type": "array",
      "items": { "type": "string" },
      "description": "Human-readable list of unbounded/invalid acceptances (empty on PASS)."
    },
    "residual_risk": {
      "type": "object",
      "required": ["open_accepted_risks", "by_severity", "open_risks", "board_tolerance", "statement", "signed_by_accountable_officer"],
      "additionalProperties": true,
      "properties": {
        "open_accepted_risks": {
          "type": "integer",
          "minimum": 0,
          "description": "Count of Active (open) accepted risks. 0 is a valid 'no exceptions noted' state."
        },
        "by_severity": {
          "type": "object",
          "description": "Open-risk count keyed by severity (Critical/High/Medium/Low/Unspecified).",
          "additionalProperties": { "type": "integer", "minimum": 0 }
        },
        "status_counts": {
          "type": "object",
          "description": "Count of register rows by normalised Status token (active/expired/remediated/...).",
          "additionalProperties": { "type": "integer", "minimum": 0 }
        },
        "soonest_expiry": {
          "description": "The open risk expiring soonest, or null when no dated open risks exist.",
          "oneOf": [
            { "type": "null" },
            {
              "type": "object",
              "required": ["id", "expiry", "days_to_expiry"],
              "additionalProperties": true,
              "properties": {
                "id": { "type": "string" },
                "expiry": { "type": "string" },
                "days_to_expiry": { "type": "integer" }
              }
            }
          ]
        },
        "open_risks": {
          "type": "array",
          "description": "One entry per Active accepted risk.",
          "items": {
            "type": "object",
            "required": ["id", "approver", "expiry"],
            "additionalProperties": true,
            "properties": {
              "id": { "type": "string" },
              "control": { "type": "string" },
              "vuln_id": { "type": "string" },
              "severity": { "type": "string" },
              "owner": { "type": "string" },
              "approver": { "type": "string" },
              "expiry": { "type": "string" },
              "days_to_expiry": { "type": ["integer", "null"] },
              "violations": { "type": "array", "items": { "type": "string" } }
            }
          }
        },
        "board_tolerance": {
          "type": "object",
          "description": "Reference block tying residual risk to the board-approved tolerance (DORA Art. 5(2)).",
          "additionalProperties": true,
          "properties": {
            "basis": { "type": "string" },
            "iso_27001_2022": { "type": "string" },
            "tolerance_document": { "type": "string" },
            "risk_register": { "type": "string" }
          }
        },
        "statement": {
          "type": "string",
          "description": "Human-readable residual-risk statement text (Part D.4)."
        },
        "signed_by_accountable_officer": {
          "type": "boolean",
          "description": "ALWAYS false at validation time. The officer signature is applied at seal time (human act); the validator never asserts it."
        }
      }
    }
  }
}
